{
  "schema_id": "forge-game://schemas/template-manifest/1.0.0",
  "schema_version": "1.0.0",
  "template_set_id": "forge-game-project-local",
  "template_set_version": "1.8.0",
  "input_schema_id": "forge-game://schemas/projection-input/1.0.0",
  "supported_variants": ["default"],
  "templates": [
    {
      "template_id": "root-agents",
      "version": "1.2.0",
      "source": "root-agents.md.tmpl",
      "target": "AGENTS.md",
      "ownership": "user-owned",
      "renderer": "restricted-text",
      "required_inputs": ["project_name", "gdd_ref", "roadmap_ref", "architecture_ref", "nfr_ref", "engineering_rules_ref", "engineering_catalog_ref"],
      "constants": {},
      "variants": ["default"],
      "validations": ["utf8", "skill-free-markdown"],
      "source_hash": "sha256:b8603aa7595206c327832c6af1fbfd738c223dccf29c9479f3e1b1ffef0c2901"
    },
    {
      "template_id": "nested-agents",
      "version": "1.2.0",
      "source": "nested-agents.md.tmpl",
      "target": "{{text:module_path}}/AGENTS.md",
      "ownership": "user-owned",
      "renderer": "restricted-text",
      "required_inputs": ["module_name", "module_path", "architecture_ref", "engineering_rules_ref"],
      "constants": {},
      "variants": ["default"],
      "validations": ["utf8", "skill-free-markdown"],
      "source_hash": "sha256:7642ec432d5cfa1c5c6d45a685197eaa4d127422a99ed9046350b7aaf7be1921",
      "repeat": "modules"
    },
    {
      "template_id": "role-skill",
      "version": "1.2.0",
      "source": "role-skill.md.tmpl",
      "target": ".agents/skills/{{text:role_slug}}/SKILL.md",
      "ownership": "generated",
      "renderer": "restricted-text",
      "required_inputs": ["role_slug", "role_title", "role_description", "role_inputs", "role_outputs", "role_success", "gdd_ref", "roadmap_ref", "architecture_ref", "nfr_ref", "engineering_rules_ref", "engineering_catalog_ref"],
      "constants": {},
      "variants": ["default"],
      "validations": ["utf8", "skill"],
      "source_hash": "sha256:32b0a5c6ceaba014172380e145369578ea5afbb812baf4c8b351f9f581f49069",
      "repeat": "roles"
    },
    {
      "template_id": "role-skill-interface",
      "version": "1.0.0",
      "source": "role-openai.yaml.tmpl",
      "target": ".agents/skills/{{text:role_slug}}/agents/openai.yaml",
      "ownership": "generated",
      "renderer": "restricted-text",
      "required_inputs": ["role_slug", "role_title", "role_short_description"],
      "constants": {},
      "variants": ["default"],
      "validations": ["utf8", "openai-yaml"],
      "source_hash": "sha256:039afbe161a9702475417e1bebffbf1d75812dd45025016c3327f0209e3d7168",
      "repeat": "roles"
    },
    {
      "template_id": "role-agent-profile",
      "version": "1.0.0",
      "source": "role-agent.toml.tmpl",
      "target": ".codex/agents/{{text:role_slug}}.toml",
      "ownership": "generated",
      "renderer": "toml",
      "required_inputs": ["role_slug", "role_agent_name", "role_short_description", "sandbox_mode", "write_boundary"],
      "constants": {},
      "variants": ["default"],
      "validations": ["utf8", "toml"],
      "source_hash": "sha256:a8e42f73d72e125df8c225c0b927fb3a7b34498028950680531163d8552e14b8",
      "repeat": "roles"
    },
    {
      "template_id": "codex-config",
      "version": "1.2.0",
      "source": "codex-config.toml.tmpl",
      "target": ".codex/config.toml",
      "ownership": "managed",
      "renderer": "toml",
      "required_inputs": ["agent_declarations"],
      "constants": {},
      "variants": ["default"],
      "validations": ["utf8", "toml", "codex-config"],
      "source_hash": "sha256:92878cf947304b893ac25aac29a237a5a23a606b4ce7905b7a3d50f43d3cf3f9"
    },
    {
      "template_id": "codex-policy-hook",
      "version": "1.1.0",
      "source": "policy-hook.py.tmpl",
      "target": ".codex/hooks/forge_game_policy.py",
      "ownership": "generated",
      "renderer": "exact-copy",
      "required_inputs": [],
      "constants": {},
      "variants": ["default"],
      "validations": ["utf8", "python"],
      "source_hash": "sha256:20e820218e3f419a91eaf7afdc2d8b018348af918ff5878352adc01142e0f969",
      "executable": true
    },
    {
      "template_id": "policy-gateway",
      "version": "1.0.0",
      "source": "policy-gateway.py.tmpl",
      "target": ".forge-game/bin/policy-check",
      "ownership": "generated",
      "renderer": "exact-copy",
      "required_inputs": [],
      "constants": {},
      "variants": ["default"],
      "validations": ["utf8", "python"],
      "source_hash": "sha256:d6b714fa046343351a7a01c088b2e902dd143a61b0af82e9fa4bd6397f98d8f6",
      "executable": true
    },
    {
      "template_id": "control-wrapper",
      "version": "1.1.0",
      "source": "control-wrapper.sh.tmpl",
      "target": ".forge-game/bin/forge-game-control",
      "ownership": "generated",
      "renderer": "exact-copy",
      "required_inputs": [],
      "constants": {},
      "variants": ["default"],
      "validations": ["utf8", "shell"],
      "source_hash": "sha256:995d3ddb8ade6ee04061f7df1debeeac6ae8189cc1144bb51dfbed3dd52ff061",
      "executable": true
    },
    {
      "template_id": "control-entrypoint",
      "version": "1.0.0",
      "source": "control-wrapper.py.tmpl",
      "target": ".forge-game/bin/forge-game-control.py",
      "ownership": "generated",
      "renderer": "exact-copy",
      "required_inputs": [],
      "constants": {},
      "variants": ["default"],
      "validations": ["utf8", "python"],
      "source_hash": "sha256:317da8aa40be675543dc87a2821e43327d902dedb4133d5d45604fc63116090c",
      "executable": false
    },
    {
      "template_id": "command-wrapper",
      "version": "1.1.0",
      "source": "command-wrapper.sh.tmpl",
      "target": ".forge-game/bin/run-command",
      "ownership": "generated",
      "renderer": "exact-copy",
      "required_inputs": [],
      "constants": {},
      "variants": ["default"],
      "validations": ["utf8", "shell"],
      "source_hash": "sha256:cbd02c5835c675636e6d77975485f49948ab398dd89b9e498e16ff01d41686d9",
      "executable": true
    },
    {
      "template_id": "command-runner",
      "version": "1.0.0",
      "source": "command-runner.py.tmpl",
      "target": ".forge-game/bin/run-command.py",
      "ownership": "generated",
      "renderer": "exact-copy",
      "required_inputs": [],
      "constants": {},
      "variants": ["default"],
      "validations": ["utf8", "python"],
      "source_hash": "sha256:804bf4212e00d119c9af428c7854985fe7b773497a89a516f776f57e7871aaf1",
      "executable": true
    },
    {
      "template_id": "commands-manifest",
      "version": "1.0.0",
      "source": "commands.json.tmpl",
      "target": ".forge-game/manifests/commands.json",
      "ownership": "generated",
      "renderer": "json",
      "required_inputs": ["canonical_commands"],
      "constants": {},
      "variants": ["default"],
      "validations": ["utf8", "json"],
      "source_hash": "sha256:422c1254de0e34b1d84b4c0d8a4340dd298264281ba3dfeb892915e5f9900b1d"
    },
    {
      "template_id": "gitignore",
      "version": "1.2.0",
      "source": "gitignore.lines.tmpl",
      "target": ".gitignore",
      "ownership": "managed",
      "renderer": "git-lines",
      "required_inputs": [],
      "constants": {},
      "variants": ["default"],
      "validations": ["utf8", "git-lines"],
      "source_hash": "sha256:1d5ad3d21eb43eb0332a228fb51ce947a5beb672bb8952d3dfc7c6d8e14dbeaa"
    },
    {
      "template_id": "gitattributes",
      "version": "1.0.0",
      "source": "gitattributes.lines.tmpl",
      "target": ".gitattributes",
      "ownership": "managed",
      "renderer": "git-lines",
      "required_inputs": ["lfs_attribute_lines"],
      "constants": {},
      "variants": ["default"],
      "validations": ["utf8", "git-lines"],
      "source_hash": "sha256:4aaf57822be0efd5ecb5d81ff75cc7499dacd5eefec485aa69170fe668069b90"
    },
    {
      "template_id": "github-ci",
      "version": "1.0.0",
      "source": "github-ci.yaml.tmpl",
      "target": ".github/workflows/forge-game.yml",
      "ownership": "managed",
      "renderer": "ci",
      "required_inputs": [],
      "constants": {},
      "variants": ["default"],
      "validations": ["utf8", "github-actions"],
      "source_hash": "sha256:e66c5303e7b4e81fe6031c61d524a12e6db63f3395f289ee32948d4e21ecf852",
      "condition": {"field": "ci_provider", "equals": "github"}
    },
    {
      "template_id": "engineering-rules",
      "version": "1.0.0",
      "source": "engineering-rules.md.tmpl",
      "target": ".forge-game/policy/engineering-rules.md",
      "ownership": "generated",
      "renderer": "restricted-text",
      "required_inputs": ["engineering_rules_markdown"],
      "constants": {},
      "variants": ["default"],
      "validations": ["utf8", "skill-free-markdown"],
      "source_hash": "sha256:d640a0b4029755a3afb11d9405c004944b3696d676145bd54c63d0a4bdbb0d7f"
    },
    {
      "template_id": "engineering-rule-catalog",
      "version": "1.0.0",
      "source": "engineering-rule-catalog.json.tmpl",
      "target": ".forge-game/policy/engineering-rule-catalog.json",
      "ownership": "generated",
      "renderer": "json",
      "required_inputs": ["engineering_rule_catalog"],
      "constants": {},
      "variants": ["default"],
      "validations": ["utf8", "json", "schema:forge-game://schemas/engineering-rule-catalog/1.0.0"],
      "source_hash": "sha256:dcacb2dab71c328d75395ba89fbe51aa294724d85e58961cce5b4ef03327204f"
    },
    {
      "template_id": "forge-game-index",
      "version": "1.2.0",
      "source": "docs-index.md.tmpl",
      "target": "docs/forge-game/index.md",
      "ownership": "generated",
      "renderer": "restricted-text",
      "required_inputs": ["project_name", "gdd_ref", "roadmap_ref", "architecture_ref", "nfr_ref", "unreal_engine_version", "target_platforms_text", "engineering_rules_ref", "engineering_catalog_ref"],